{
  "type": "object",
  "required": [
    "_headers",
    "active",
    "adult",
    "bonusCommunicationEnable",
    "brand",
    "category",
    "description",
    "extraDescriptions",
    "forbidden",
    "id",
    "image",
    "images",
    "informers",
    "isCart",
    "isFavorite",
    "isFresh",
    "isHit",
    "isNew",
    "isPromo",
    "isQRMark",
    "isSeason",
    "properties",
    "sku",
    "specialPrice",
    "title",
    "unitPrice",
    "unitType",
    "url",
    "variants",
    "video",
    "videoLink"
  ],
  "$schema": "https://json-schema.org/draft/2020-12/schema",
  "properties": {
    "_headers": {
      "type": "object",
      "required": [
        "access-control-allow-credentials",
        "access-control-allow-headers",
        "access-control-allow-methods",
        "access-control-allow-origin",
        "access-control-expose-headers",
        "access-control-max-age",
        "cache-control",
        "content-type",
        "date",
        "is-logged",
        "server",
        "transfer-encoding",
        "vary",
        "x-city",
        "x-language",
        "x-logged"
      ],
      "properties": {
        "access-control-allow-credentials": {
          "type": "string",
          "enum": [
            "true"
          ]
        },
        "access-control-allow-headers": {
          "type": "string",
          "j2sEnumRejected": true
        },
        "access-control-allow-methods": {
          "type": "string",
          "j2sEnumRejected": true
        },
        "access-control-allow-origin": {
          "type": "string",
          "enum": [
            "*"
          ]
        },
        "access-control-expose-headers": {
          "type": "string",
          "j2sEnumRejected": true
        },
        "access-control-max-age": {
          "type": "string",
          "j2sEnumRejected": true
        },
        "cache-control": {
          "type": "string",
          "enum": [
            "public, max-age=3600"
          ]
        },
        "connection": {
          "type": "string",
          "enum": [
            "close"
          ]
        },
        "content-type": {
          "type": "string",
          "j2sEnumRejected": true
        },
        "date": {
          "type": "string",
          "j2sEnumRejected": true
        },
        "is-logged": {
          "type": "string",
          "j2sEnumRejected": true
        },
        "server": {
          "type": "string",
          "enum": [
            "Unit/1.34.2"
          ]
        },
        "transfer-encoding": {
          "type": "string",
          "enum": [
            "chunked"
          ]
        },
        "vary": {
          "type": "string",
          "j2sEnumRejected": true
        },
        "x-city": {
          "type": "string",
          "j2sEnumRejected": true
        },
        "x-language": {
          "type": "string",
          "enum": [
            "ru"
          ]
        },
        "x-logged": {
          "type": "string",
          "j2sEnumRejected": true
        }
      }
    },
    "active": {
      "type": "boolean"
    },
    "adult": {
      "type": "boolean"
    },
    "bonusCommunicationEnable": {
      "type": "boolean"
    },
    "brand": {
      "type": "object",
      "required": [
        "alias",
        "id",
        "isFavorite",
        "isSTM",
        "login",
        "src",
        "title",
        "updated_at",
        "url"
      ],
      "properties": {
        "alias": {
          "type": "string",
          "j2sEnumRejected": true
        },
        "id": {
          "type": "integer"
        },
        "isFavorite": {
          "type": "boolean"
        },
        "isSTM": {
          "type": "boolean"
        },
        "login": {
          "type": "null"
        },
        "src": {
          "type": "string",
          "j2sEnumRejected": true
        },
        "title": {
          "type": "string",
          "j2sEnumRejected": true
        },
        "updated_at": {
          "type": "null"
        },
        "url": {
          "type": "null"
        }
      }
    },
    "category": {
      "type": "integer"
    },
    "description": {
      "type": "string",
      "j2sEnumRejected": true
    },
    "extraDescriptions": {
      "type": "array",
      "items": {
        "type": "object",
        "required": [
          "alias",
          "id",
          "title",
          "value"
        ],
        "properties": {
          "alias": {
            "type": "string",
            "enum": [
              "nutritionalValue",
              "composition",
              "manufacturerAddress",
              "nutritionalValueSeparated"
            ]
          },
          "id": {
            "type": "integer"
          },
          "title": {
            "type": "string",
            "j2sEnumRejected": true
          },
          "value": {
            "anyOf": [
              {
                "type": "string",
                "j2sEnumRejected": true
              },
              {
                "type": "object",
                "required": [
                  "carbohydrates",
                  "description",
                  "energyValue",
                  "fats",
                  "protein"
                ],
                "properties": {
                  "carbohydrates": {
                    "type": "string",
                    "j2sEnumRejected": true
                  },
                  "description": {
                    "type": "string",
                    "j2sEnumRejected": true
                  },
                  "energyValue": {
                    "type": "string",
                    "j2sEnumRejected": true
                  },
                  "fats": {
                    "type": "string",
                    "j2sEnumRejected": true
                  },
                  "protein": {
                    "type": "string",
                    "j2sEnumRejected": true
                  }
                }
              }
            ]
          }
        }
      }
    },
    "forbidden": {
      "type": "boolean"
    },
    "id": {
      "type": "integer"
    },
    "image": {
      "type": "integer"
    },
    "images": {
      "$ref": "#/$defs/Images"
    },
    "informers": {
      "type": "array",
      "items": {
        "type": "object",
        "required": [
          "alias"
        ],
        "properties": {
          "alias": {
            "type": "string",
            "enum": [
              "loyaltyProgram"
            ]
          }
        }
      }
    },
    "isCart": {
      "type": "boolean"
    },
    "isFavorite": {
      "type": "boolean"
    },
    "isFresh": {
      "type": "boolean"
    },
    "isHit": {
      "type": "boolean"
    },
    "isNew": {
      "type": "boolean"
    },
    "isPromo": {
      "type": "boolean"
    },
    "isQRMark": {
      "type": "boolean"
    },
    "isSeason": {
      "type": "boolean"
    },
    "properties": {
      "$ref": "#/$defs/Array1"
    },
    "resources": {
      "$ref": "#/$defs/Resources"
    },
    "sku": {
      "type": "string",
      "j2sEnumRejected": true
    },
    "specialPrice": {
      "type": "null"
    },
    "title": {
      "type": "string",
      "j2sEnumRejected": true
    },
    "unitPrice": {
      "type": "string",
      "j2sEnumRejected": true
    },
    "unitType": {
      "type": "null"
    },
    "url": {
      "type": "string",
      "j2sEnumRejected": true
    },
    "variants": {
      "type": "array",
      "items": {
        "type": "object",
        "required": [
          "barcode",
          "count",
          "dimensions",
          "fixPrice",
          "height",
          "id",
          "image",
          "length",
          "price",
          "properties",
          "title",
          "unitPrice",
          "weight",
          "width"
        ],
        "properties": {
          "barcode": {
            "type": "string",
            "j2sEnumRejected": true
          },
          "count": {
            "type": "integer"
          },
          "dimensions": {
            "type": "object",
            "required": [
              "height",
              "isPackage",
              "length",
              "weight",
              "width"
            ],
            "properties": {
              "height": {
                "type": "integer"
              },
              "isPackage": {
                "type": "boolean"
              },
              "length": {
                "type": "integer"
              },
              "weight": {
                "type": "integer"
              },
              "width": {
                "type": "integer"
              }
            }
          },
          "fixPrice": {
            "type": "string",
            "j2sEnumRejected": true
          },
          "height": {
            "type": "integer"
          },
          "id": {
            "type": "integer"
          },
          "image": {
            "anyOf": [
              {
                "type": "null"
              },
              {
                "type": "integer"
              }
            ]
          },
          "images": {
            "$ref": "#/$defs/Images"
          },
          "length": {
            "type": "integer"
          },
          "price": {
            "type": "string",
            "j2sEnumRejected": true
          },
          "properties": {
            "$ref": "#/$defs/Array1"
          },
          "resources": {
            "$ref": "#/$defs/Resources"
          },
          "title": {
            "type": "string",
            "j2sEnumRejected": true
          },
          "unitPrice": {
            "type": "string",
            "j2sEnumRejected": true
          },
          "weight": {
            "type": "integer"
          },
          "width": {
            "type": "integer"
          }
        }
      }
    },
    "video": {
      "type": "null"
    },
    "videoLink": {
      "type": "null"
    }
  },
  "$defs": {
    "Array1": {
      "type": "array",
      "minItems": 1,
      "items": {
        "type": "object",
        "required": [
          "alias",
          "id",
          "title",
          "value"
        ],
        "minProperties": 1,
        "properties": {
          "alias": {
            "type": "string",
            "enum": [
              "prodCountry",
              "manufacturer",
              "fake",
              "variant"
            ]
          },
          "id": {
            "type": "integer"
          },
          "title": {
            "type": "string",
            "j2sEnumRejected": true
          },
          "value": {
            "type": "string",
            "enum": [
              "Россия",
              "ООО \"ТД \"Алтей\"",
              "Ассортимент",
              "Пломбир"
            ]
          }
        }
      }
    },
    "Images": {
      "type": "array",
      "minItems": 1,
      "items": {
        "type": "object",
        "required": [
          "id",
          "src",
          "title"
        ],
        "minProperties": 1,
        "properties": {
          "id": {
            "type": "integer"
          },
          "src": {
            "type": "string",
            "format": "uri"
          },
          "title": {
            "type": "null"
          }
        }
      }
    },
    "Resources": {
      "type": "array",
      "minItems": 1,
      "items": {
        "type": "object",
        "required": [
          "link",
          "src",
          "videoType"
        ],
        "minProperties": 1,
        "properties": {
          "link": {
            "type": "null"
          },
          "src": {
            "type": "string",
            "format": "uri"
          },
          "videoType": {
            "type": "null"
          }
        }
      }
    }
  }
}